{
  "documentId": "handoff-agentschema-v2",
  "documentType": "Handoff",
  "schemaRef": "HandoffSchema/v1",
  "content": {
    "title": {
      "blockType": "Title",
      "title": "handoff-agentschema-v2"
    },
    "specRef": {
      "blockType": "SpecRef",
      "title": "引き継ぎ元spec",
      "specRef": "agg-schema"
    },
    "designViewpoints": {
      "blockType": "DesignViewpoints",
      "title": "設計観点",
      "items": [
        {
          "advisor": "ddd-advisor",
          "viewpoint": "guardrails/preconditionsをdiscriminator（種別）ではなく任意ブロックとして設計する判断は妥当",
          "consideration": "禁止事項・前提条件は「SubagentContentという一つの集約が持ちうる属性の有無」であり「別の種類のSubagentが存在する」わけではない。種別を増やすことは新たな分岐＝新たな集約構造を生むため、任意ブロックのままにする方が正しい。ただしskillPreloads/toolAccess/runtimeConfigと同列に並べる場合、フィールド間に順序依存や相互排他がないかは要確認（例: guardrailsが実質空配列＝省略と同義になる抜け道がないか）。"
        },
        {
          "advisor": "ddd-advisor",
          "viewpoint": "「型は1枚の永続ファイル、値は都度DI」という二層構造はWaffleの集約境界を侵犯しない",
          "consideration": "bounded-contextの原則では境界の内側でのみ言葉の一貫性を保証すればよく、`.claude/agents/`というClaude Codeツール固有のディレクトリはWaffleのDocument集約が管轄する範囲ではない。SubagentContentは構造を定義するのみで、waffle-subagent.mdはその構造を解釈する側の固定的な受け皿にすぎず、値そのものを保持・永続化しない。AgentSchema/v2を「ファイルとして永続化・登録しない」という既存方針とも整合する。"
        },
        {
          "advisor": "tech-lead-advisor",
          "viewpoint": "waffle-subagent.mdはAgentSchema/v2の抽象的なフィールド構造にのみ言及してよく、具体的なファイルパス・schemaRefバージョンには言及すべきでない",
          "consideration": "依存方向原則上、外側（waffle-subagent.md、インフラ層相当）が内側（AgentSchema/v2、ドメイン層相当）のブロック構造（goal/persona/task等）を知ることは、アダプターがポートの入出力形状を知るのと同型で許容される。しかし「どのschemaRefからこの形を埋めるか」を決定する配線はcomposition-root原則により1箇所（Orchestrator）に集約すべきで、waffle-subagent.md自体はその配線先を知らない「契約の受け手」に徹するべき。"
        }
      ]
    },
    "implementationViewpoints": {
      "blockType": "ImplementationViewpoints",
      "title": "実装観点",
      "items": [
        {
          "advisor": "tech-lead-advisor",
          "viewpoint": "render-blank-templateの出力をAgentツールへ渡す処理はOrchestrator（CLAUDE.md）側の責務とする",
          "consideration": "render-blank-templateは純粋変換（値埋め）に留まり、既存check-*系usecaseの「実行/意味理解はしない」規律と整合する。しかしその出力をAgentツールへ渡して実際に呼び出す行為は副作用を伴う調整であり、複数処理を横断して調整する処理はアプリケーション層/Orchestratorの責務にあたる。SkillやCLI呼び出し元に持たせない。"
        }
      ]
    },
    "constraints": {
      "blockType": "Constraints",
      "title": "既知の制約・トレードオフ",
      "items": [
        "guardrailsが実質空配列（=省略と同義）になる抜け道がないか、x-prompt-writeの文言だけでなく運用時にも確認する（ddd-advisorの懸念）。",
        "waffle-subagent.mdはAgentSchema/v2の具体的なファイルパス・schemaRefバージョンを書き込まない。書き込むとschema改版のたびに手動同期が必要になり、コンポジションルートが分散するアンチパターンになる（tech-lead-advisorの指摘）。抽象的なフィールド構造の記述のみに留め、具体的なschemaRef参照とrender呼び出しはOrchestrator側の1箇所に集約する。"
      ]
    }
  },
  "tags": []
}
